{
  "qid": "Q1782533",
  "lang": "en",
  "title": "Battle of Ingavi",
  "revid": 1372630726,
  "fetched": "2026-10-30",
  "license": "CC-BY-SA-4.0",
  "url": "https://en.wikipedia.org/wiki/Battle_of_Ingavi",
  "historyUrl": "https://en.wikipedia.org/w/index.php?title=Battle_of_Ingavi&action=history",
  "text": "The Battle of Ingavi was fought on 18 November 1841, near Viacha, during the Peruvian–Bolivian War of 1841–1842. The Bolivian Army under the command of José Ballivián repelled the invading Peruvian Army commanded by Agustín Gamarra, who was killed in action. Ingavi was the decisive engagement that prevented Peruvian annexation and secured Bolivian independence."
}
