{
  "qid": "Q4065",
  "lang": "en",
  "title": "Stralsund",
  "revid": 1376052041,
  "fetched": "2026-09-22",
  "license": "CC-BY-SA-4.0",
  "url": "https://en.wikipedia.org/wiki/Stralsund",
  "historyUrl": "https://en.wikipedia.org/w/index.php?title=Stralsund&action=history",
  "text": "Stralsund, officially the Hanseatic City of Stralsund, is the fifth-largest city in the northeastern German state of Mecklenburg-Western Pomerania after Rostock, Schwerin, Neubrandenburg and Greifswald, and the second-largest city in the Pomeranian part of the state. It is located on the southern coast of the Strelasund, a sound of the Baltic Sea separating the island of Rügen from the Pomeranian mainland."
}
