{
  "qid": "Q3636591",
  "lang": "en",
  "title": "Battle of Puná",
  "revid": 1370586803,
  "fetched": "2026-09-24",
  "license": "CC-BY-SA-4.0",
  "url": "https://en.wikipedia.org/wiki/Battle_of_Pun%C3%A1",
  "historyUrl": "https://en.wikipedia.org/w/index.php?title=Battle_of_Pun%C3%A1&action=history",
  "text": "The Battle of Puná, a peripheral engagement of Francisco Pizarro's conquest of Peru, was fought in April 1531 on the island of Puná in Ecuador. Pizarro's conquistadors, boasting superior weaponry and tactical skill, decisively defeated the island's indigenous inhabitants. The battle marked the beginning of Pizarro's third and final expedition prior to the fall of the Inca Empire."
}
