{
  "qid": "Q1881990",
  "lang": "en",
  "title": "Second Treaty of San Ildefonso",
  "revid": 1367362336,
  "fetched": "2026-10-28",
  "license": "CC-BY-SA-4.0",
  "url": "https://en.wikipedia.org/wiki/Second_Treaty_of_San_Ildefonso",
  "historyUrl": "https://en.wikipedia.org/w/index.php?title=Second_Treaty_of_San_Ildefonso&action=history",
  "text": "The Second Treaty of San Ildefonso was signed on 19 August 1796 between the Spanish Empire and the First French Republic. Based on the terms of the agreement, France and Spain would become allies and combine their forces against the Kingdom of Great Britain."
}
