{
  "qid": "Q11681484",
  "lang": "en",
  "title": "Zliten uprising",
  "revid": 1374516568,
  "fetched": "2026-09-25",
  "license": "CC-BY-SA-4.0",
  "url": "https://en.wikipedia.org/wiki/Zliten_uprising",
  "historyUrl": "https://en.wikipedia.org/w/index.php?title=Zliten_uprising&action=history",
  "text": "The Zliten uprising was a local uprising in the Libyan Civil War, started by rebel anti-Gaddafi forces against loyalist pro-Gaddafi forces in the city of Zliten. The city was of strategic importance due to its close proximity to the capital of Tripoli. After Zliten, only two cities – Khoms and Tajura – separated the rebel stronghold of Misrata from Tripoli."
}
