{
  "qid": "Q2007212",
  "lang": "pt",
  "title": "Batalha de Otlukbeli",
  "revid": 72733639,
  "fetched": "2026-10-28",
  "license": "CC-BY-SA-4.0",
  "url": "https://pt.wikipedia.org/wiki/Batalha_de_Otlukbeli",
  "historyUrl": "https://pt.wikipedia.org/w/index.php?title=Batalha_de_Otlukbeli&action=history",
  "text": "A Batalha de Otlukbeli ou Otluk Beli foi travada entre os Aq Qoyunlu e o Império Otomano em 11 de agosto de 1473."
}
