{
  "qid": "Q552574",
  "lang": "en",
  "title": "Battle of Cassano (1705)",
  "revid": 1381047367,
  "fetched": "2026-10-27",
  "license": "CC-BY-SA-4.0",
  "url": "https://en.wikipedia.org/wiki/Battle_of_Cassano_(1705)",
  "historyUrl": "https://en.wikipedia.org/w/index.php?title=Battle_of_Cassano_%281705%29&action=history",
  "text": "The Battle of Cassano took place on 16 August 1705, during the War of the Spanish Succession, near Cassano d'Adda, in Lombardy, Italy. It was fought between a French army commanded by the duc de Vendôme, and an Imperial force under Prince Eugene of Savoy."
}
