{
  "qid": "Q1922071",
  "lang": "pt",
  "title": "Guerra Indo-Paquistanesa de 1971",
  "revid": 71378102,
  "fetched": "2026-09-23",
  "license": "CC-BY-SA-4.0",
  "url": "https://pt.wikipedia.org/wiki/Guerra_Indo-Paquistanesa_de_1971",
  "historyUrl": "https://pt.wikipedia.org/w/index.php?title=Guerra_Indo-Paquistanesa_de_1971&action=history",
  "text": "A Guerra indo-paquistanesa de 1971 foi um grande conflito militar entre a Índia e o Paquistão; a guerra estava estreitamente associada com a Guerra de Independência de Bangladesh. Embora haja divergências sobre as datas exatas da guerra, as hostilidades entre a Índia e o Paquistão oficialmente começaram na tarde de 3 de dezembro de 1971. Fontes indianas, bangladeshis e internacionais consideram o início da guerra como sendo a Operação Gengis Khan, em 3 de Dezembro de 1971, um ataque preventivo do Paquistão em 11 bases aéreas indianas que dura apenas 13 dias e é considerado um dos mais curtos das guerras na história."
}
