{
  "qid": "Q7837136",
  "lang": "en",
  "title": "Treaty of Managua",
  "revid": 1373600421,
  "fetched": "2026-10-31",
  "license": "CC-BY-SA-4.0",
  "url": "https://en.wikipedia.org/wiki/Treaty_of_Managua",
  "historyUrl": "https://en.wikipedia.org/w/index.php?title=Treaty_of_Managua&action=history",
  "text": "The Treaty of Managua, also known as the Zeledon–Wyke treaty, was an 1860 agreement between the United Kingdom and Nicaragua, in which Britain recognised Nicaraguan sovereignty over the Kingdom of Mosquitia, but reserved, on the basis of historical rights, a self-governing enclave known of the Mosquito Reservation for the people, citing earlier treaty arrangements and historical circumstances."
}
