{
  "qid": "Q2628049",
  "lang": "pt",
  "title": "Batalha de Zieleńce",
  "revid": 72200328,
  "fetched": "2026-10-29",
  "license": "CC-BY-SA-4.0",
  "url": "https://pt.wikipedia.org/wiki/Batalha_de_Ziele%C5%84ce",
  "historyUrl": "https://pt.wikipedia.org/w/index.php?title=Batalha_de_Ziele%C5%84ce&action=history",
  "text": "A Batalha de Zieleńce foi uma batalha da Guerra Polaco-Russa de 1792, em defesa da Constituição Polonesa de 3 de maio de 1791. A batalha ocorreu em 18 de junho de 1792, entre o Exército da Comunidade Polaco-Lituana de Józef Poniatowski e um grupo do Exército Imperial Russo sob o comando do general Irakly Morkov, que fazia parte das forças russas do general Mikhail Krechetnikov que invadiam a Comunidade Polaco-Lituana pelo sul. A batalha terminou com vitória polonesa, pois o ataque russo foi repelido, embora os poloneses logo tenham se retirado do campo de batalha."
}
