{
  "qid": "Q7510141",
  "lang": "en",
  "title": "Siege of Kaminogō Castle",
  "revid": 1380072278,
  "fetched": "2026-10-31",
  "license": "CC-BY-SA-4.0",
  "url": "https://en.wikipedia.org/wiki/Siege_of_Kaminog%C5%8D_Castle",
  "historyUrl": "https://en.wikipedia.org/w/index.php?title=Siege_of_Kaminog%C5%8D_Castle&action=history",
  "text": "The siege of Kaminogō Castle was a battle in 1562, during the Sengoku period of Japan. Kaminogō Castle was an Imagawa clan outpost located in eastern Aichi Prefecture, in what is now the town of Gamagōri."
}
