{
  "qid": "Q27627673",
  "lang": "en",
  "title": "Battle of Abu Hamed",
  "revid": 1370430843,
  "fetched": "2026-10-28",
  "license": "CC-BY-SA-4.0",
  "url": "https://en.wikipedia.org/wiki/Battle_of_Abu_Hamed",
  "historyUrl": "https://en.wikipedia.org/w/index.php?title=Battle_of_Abu_Hamed&action=history",
  "text": "The Battle of Abu Hamed occurred on 7 August 1897 between a flying column of Anglo-Egyptian soldiers under Major-General Sir Archibald Hunter and a garrison of Mahdist rebels led by Mohammed Zain. The battle was a victory for the Anglo-Egyptian forces, and secured for the British the strategically vital town of Abu Hamed, which was the terminus for trade and transportation across the Nubian Desert."
}
