{
  "qid": "Q3523487",
  "lang": "en",
  "title": "Orissa famine of 1866",
  "revid": 1370325526,
  "fetched": "2026-10-29",
  "license": "CC-BY-SA-4.0",
  "url": "https://en.wikipedia.org/wiki/Orissa_famine_of_1866",
  "historyUrl": "https://en.wikipedia.org/w/index.php?title=Orissa_famine_of_1866&action=history",
  "text": "The Orissa famine of 1866 affected the east coast of India from Madras northwards, an area covering 180,000 miles and containing a population of 47,500,000; the impact of the famine, however, was greatest in the region of Orissa, now Odisha, which at that time was quite isolated from the rest of India. In Odisha, the total number of deaths as a result of the famine was at least a million, roughly one third of the population."
}
