{
  "qid": "Q748042",
  "lang": "en",
  "title": "Irish Civil War",
  "revid": 1374338052,
  "fetched": "2026-09-15",
  "license": "CC-BY-SA-4.0",
  "url": "https://en.wikipedia.org/wiki/Irish_Civil_War",
  "historyUrl": "https://en.wikipedia.org/w/index.php?title=Irish_Civil_War&action=history",
  "text": "The Irish Civil War was a conflict that followed the Irish War of Independence and accompanied the establishment of the Irish Free State, an entity independent from the United Kingdom but within the British Empire."
}
