{
  "qid": "Q14928070",
  "lang": "en",
  "title": "1838 Druze attack on Safed",
  "revid": 1373738642,
  "fetched": "2026-10-31",
  "license": "CC-BY-SA-4.0",
  "url": "https://en.wikipedia.org/wiki/1838_Druze_attack_on_Safed",
  "historyUrl": "https://en.wikipedia.org/w/index.php?title=1838_Druze_attack_on_Safed&action=history",
  "text": "The 1838 Druze attack on Safed began on July 5, 1838, during the Druze revolt against the rule of Ibrahim Pasha of Egypt. Tensions had mounted as the Druze captured an Egyptian garrison outside of Safed. The local Safed militia of several hundred was heavily outnumbered by the Druze rebels, and the city was gripped in despair as the militia eventually abandoned the city and the Druze rebels entered the city on July 5. The Druze rebels and a Muslim mob descended on the Jewish quarter of Safed and spent three days attacking Jews, plundering their homes and desecrating their synagogues, in scenes reminiscent of the looting and pillaging of the Jews in the city that took place four years earlier as part of the Peasants' revolt in Palestine. Some Jews ended up leaving the town, moving south to Jerusalem and Acre.The legacy of the riots and the earthquake led the center of Jewish life to shift from Safed to Jerusalem in the subsequent decade."
}
