{
  "qid": "Q1628090",
  "lang": "en",
  "title": "Bulgarian Declaration of Independence",
  "revid": 1375171159,
  "fetched": "2026-09-21",
  "license": "CC-BY-SA-4.0",
  "url": "https://en.wikipedia.org/wiki/Bulgarian_Declaration_of_Independence",
  "historyUrl": "https://en.wikipedia.org/w/index.php?title=Bulgarian_Declaration_of_Independence&action=history",
  "text": "The de jure independence of Bulgaria from the Ottoman Empire was proclaimed on 5 October [O.S. 22 September] 1908 in the old capital of Tarnovo by Prince Ferdinand of Bulgaria, who afterwards took the title \"Tsar\"."
}
