{
  "qid": "Q2007212",
  "lang": "en",
  "title": "Battle of Otlukbeli",
  "revid": 1382312774,
  "fetched": "2026-10-28",
  "license": "CC-BY-SA-4.0",
  "url": "https://en.wikipedia.org/wiki/Battle_of_Otlukbeli",
  "historyUrl": "https://en.wikipedia.org/w/index.php?title=Battle_of_Otlukbeli&action=history",
  "text": "The Battle of Otlukbeli The Battle of Otlukbeli was a pitched battle that took place on August 11, 1473, between the Ottoman army under the command of Sultan Mehmed the Conqueror and the army of the Aq Qoyunlu state led by Sultan Uzun Hasan, at the Otlukbeli location within the borders of present-day Erzincan. This military conflict, which pitted the two major Turkic-Islamic states in Anatolia against each other, resulted in a victory for the Ottoman Empire."
}
