{
  "qid": "Q129462983",
  "lang": "pt",
  "title": "Incêndios na ilha da Madeira em agosto de 2024",
  "revid": 70850761,
  "fetched": "2026-09-04",
  "license": "CC-BY-SA-4.0",
  "url": "https://pt.wikipedia.org/wiki/Inc%C3%AAndios_na_ilha_da_Madeira_em_agosto_de_2024",
  "historyUrl": "https://pt.wikipedia.org/w/index.php?title=Inc%C3%AAndios_na_ilha_da_Madeira_em_agosto_de_2024&action=history",
  "text": "Os incêndios na ilha da Madeira em agosto de 2024 foram um conjunto de incêndios que deflagraram inicialmente na Serra de Água, na Ilha da Madeira, a 14 de agosto de 2024, expandindo-se para pelo menos cinco concelhos, destruindo áreas florestais e rurais. Após uma semana, os incêndios continuam ativos, afectando sobretudo o Curral das Freiras e o Maciço Montanhoso Central, atingindo a floresta laurissilva, património mundial da UNESCO."
}
