{
  "qid": "Q5247548",
  "lang": "en",
  "title": "Death of Wolfgang Amadeus Mozart",
  "revid": 1382022866,
  "fetched": "2026-10-29",
  "license": "CC-BY-SA-4.0",
  "url": "https://en.wikipedia.org/wiki/Death_of_Wolfgang_Amadeus_Mozart",
  "historyUrl": "https://en.wikipedia.org/w/index.php?title=Death_of_Wolfgang_Amadeus_Mozart&action=history",
  "text": "On 5 December 1791, the composer Wolfgang Amadeus Mozart died at his home in Vienna at the age of 35. The circumstances of his death have attracted much research and speculation."
}
