{
  "qid": "Q138606175",
  "lang": "pt",
  "title": "Cerco de Anzele",
  "revid": 72188477,
  "fetched": "2026-10-02",
  "license": "CC-BY-SA-4.0",
  "url": "https://pt.wikipedia.org/wiki/Cerco_de_Anzele",
  "historyUrl": "https://pt.wikipedia.org/w/index.php?title=Cerco_de_Anzele&action=history",
  "text": "O cerco de Anzele foi uma operação armada travada entre Portugal e o Reino do Dongo em 1579 e a primeira acção militar das Guerras Angolanas, que continuariam por mais de um século."
}
