{
  "qid": "Q1093286",
  "lang": "en",
  "title": "Battle of Mondovì",
  "revid": 1370269657,
  "fetched": "2026-10-29",
  "license": "CC-BY-SA-4.0",
  "url": "https://en.wikipedia.org/wiki/Battle_of_Mondov%C3%AC",
  "historyUrl": "https://en.wikipedia.org/w/index.php?title=Battle_of_Mondov%C3%AC&action=history",
  "text": "The Battle of Mondovì was fought on 21 April 1796 between the French army of Napoleon Bonaparte and the army of the Kingdom of Sardinia-Piedmont led by Michelangelo Alessandro Colli-Marchi. The French victory meant that they had put the Ligurian Alps behind them, while the plains of Piedmont lay before them. A week later, King Victor Amadeus III sued for peace, taking his kingdom out of the First Coalition. The defeat of their Sardinian ally wrecked the Austrian Habsburg strategy and led to the loss of northwest Italy to the First French Republic."
}
