{
  "qid": "Q684324",
  "lang": "pt",
  "title": "Quinta Coligação",
  "revid": 69021713,
  "fetched": "2026-09-24",
  "license": "CC-BY-SA-4.0",
  "url": "https://pt.wikipedia.org/wiki/Quinta_Coliga%C3%A7%C3%A3o",
  "historyUrl": "https://pt.wikipedia.org/w/index.php?title=Quinta_Coliga%C3%A7%C3%A3o&action=history",
  "text": "A Quinta Coligação ou Quinta Coalizão foi a aliança formada pelo Reino Unido e pelo Império austríaco, contra a França de Napoleão Bonaparte, em 1809."
}
