{
  "qid": "Q1361354",
  "lang": "pt",
  "title": "Guerra dos Nove Anos (Irlanda)",
  "revid": 72074052,
  "fetched": "2026-10-29",
  "license": "CC-BY-SA-4.0",
  "url": "https://pt.wikipedia.org/wiki/Guerra_dos_Nove_Anos_(Irlanda)",
  "historyUrl": "https://pt.wikipedia.org/w/index.php?title=Guerra_dos_Nove_Anos_%28Irlanda%29&action=history",
  "text": "A Guerra dos Nove Anos irlandesa, também conhecida como a Rebelião de Tyrone, começou em 1594 e finalizou em 1603. Este conflito não deve ser confundido com a Guerra dos Nove Anos de 1690, parte da qual se lutou também em Irlanda. O conflito livrou-se entre as forças aliadas dos terratenentes gaélicos Hugh Ou'Neill, e Rede Hugh Ou'Donnell, contra o governo inglês isabelino que governava a ilha. Teve batalhas em todas as partes do país, mas primariamente no norte da província de Ulster. A guerra finalizou com a derrota dos chefes irlandeses, os quais foram conduzidos ao exílio na «Fuga dos Condes» e com a posterior colonização do Ulster."
}
